{
  "contract": "kujo.relay.message-envelope",
  "contract_version": "1.0",
  "message_id": "msg-relay-feature-card-001",
  "message_type": "workflow.handoff.requested",
  "sender": "feature-card-workflow",
  "recipient": "relay.local",
  "correlation_id": "run-feature-card-001",
  "causation_id": "step-change-applied",
  "sequence": 1,
  "attempt": 1,
  "idempotency_key": "run-feature-card-001:relay-handoff:1",
  "created_at": "2026-07-14T02:21:00Z",
  "delivery": {"guarantee": "local_persisted", "ack_required": true, "max_attempts": 3},
  "payload": {"mission_id": "relay-fixture-mission", "artifact_refs": ["changes.patch", "events.jsonl"]},
  "provenance": {"source_tool": "relay", "source_version": "0.1.0", "artifact_refs": ["events.jsonl", "receipts.json"]},
  "redaction": {"policy": "relay-default-redaction-v1", "redacted_fields": []}
}
